model_sentence,curie_sentence,semantic_score
"Savant syndrome is rare, and it is usually considered to be caused by a brain injury. Savant syndrome is characterized by a different pattern of brain activity, as opposed to other neurological disorders. It can be difficult to detect, as it is often subtle, and it is often difficult to diagnose. Savant syndrome can lead to a range of symptoms, including difficulty concentrating, hallucinations, and even psychosis.","Savant syndrome is a rare mental disorder characterized by a profound mental retardation and an extraordinary ability in one or more specific domains of knowledge, such as mathematics, music, or painting.",0.7695177793502808
"Rapid respiration increases the temperature of the body, which can also lead to further heat production. This is because the rate of respiration increases during times of hot weather, leading to a higher temperature in the body.","When the body produces more heat, it can raise the body's temperature even further. Rapid respiration can also lead to panting and sweating, which can further increase the body's temperature.",0.8150143623352051
"Flowers such as roses, daisies, and lilies contain hard, nutritious seeds that can be eaten or eaten as a treat.",Most flowers produce tasty seeds because they are pollinated by bees. Bees are attracted to the sweet smell of the flowers and the tasty seeds that are inside of the flowers.,0.5562134981155396
"Witnesses have deeply-etched, translucent portions that can be used to record their testimony.",Witnesses have a part of their cell membranes.,0.6268357038497925
The giant squid is typically considered to be around 6-7 meters long and can weigh up to 200 kilograms. It is usually seen in small schools with other species of squid and other squid-like creatures.,"One of the largest invertebrates in the world, the giant squid can grow to be more than 30 feet long and weigh more than a ton. They are typically seen at depths of around 600 to 1,000 feet, but have been recorded at more than 3,000 feet.",0.8183512687683105
"Most deer have upper teeth, although some species may have lower teeth. Upper teeth are usually longer and sharper than lower teeth, which are usually more serrated and curved. Upper teeth are usually used for hunting and for controlling predators. Lower teeth are usually shorter and sharper, which are used for eating and for controlling predators.",The teeth on a deer's upper jaw are the most important because they are used to break down food.,0.7603942155838013
"Headaches related to cough, exercise, or sexual activity may be of uncertain origin. It is possible that these activities may have some underlying physical cause, but it is not known for sure. In cases where symptoms are consistent with headache related conditions, further investigation may be necessary to determine the root cause.","It is unclear what causes headaches related to cough, exercise, or sexual activity.",0.9002920389175415
"Some mammals have horns, which are structures that are usually found on their heads. They are used for balance and to help with balance and balance control. Some mammals also have a number of different horns, which can be either extra- or normal-sized horns.horned mammals are animals that have an extra- or normal-sized horn. Many mammals also have a number of different horns, which can be either extra- or normal-sized horns.",Some mammals have horns as a means of protection from predators or for social signaling.,0.7037897706031799
"Cadmium remains a major issue in the municipal waste stream due to the ongoing spread of the cadmium-laced water used to irrigate farms and factories. The cadmium-laced water is one of the main sources of drinking water for local populations and may be sources of blindness if it becomes contaminated with the toxic compound. Furthermore, the cadmium-laced water can also contaminate with other contaminants such as lead, arsenic, and lead dust.",Cadmium is a heavy metal that can be harmful to the environment if it is not properly disposed of. Rechargeable batteries are a major source of cadmium pollution because they are often disposed of in landfills or incinerators.,0.7112603187561035
"Cyborgs are composed of a combination of physical and informational components. They can have physical or informational components, such as a machine brain or a cybernetic body.","Cyborgs are not just the sum of their parts, but they are made up of both physical and informational parts.",0.8937914967536926
"Satellite observations of the Earth's atmosphere, surface, and oceans can be made with space-based satellites.","Satellites can observe the Earth's atmosphere, surface and oceans by collecting data about the atmosphere, surface and oceans. The data collected can help scientists understand the Earth's climate, weather, oceanography and more.",0.7919198274612427
"Some stars appear to be single to the naked eye, but they are actually two stars orbiting each other.",Some stars look single to the naked eye but really are two stars orbiting each other. The stars orbit around each other so quickly that they appear as one object to the naked eye.,0.9091085195541382
Dashboards have a light that provides a visual view of the data stored on it. It is used to monitor the flow of data and to identify potential errors or inaccuracies.,"Dashboards have a light that indicates if a user is an ""idiot.""",0.6613332033157349
"Probation is a sentence served while under supervision in the community. Probation officers are responsible for enforcing the terms and conditions of probation, including monitoring the status of the sentence and ensuring that it is being properly served.","The sentence refers to someone who is serving a sentence, but is under supervision in the community. This means that the person is subject to regular check-ins with a probation officer.",0.7232919335365295
Some porcupines belong to families.,"Some porcupines are part of families, meaning that they live with other porcupines of their kind.",0.9225821495056152
"Cystic pheochromocytoma is a rare disease characterized by the presence of abnormal cystic changes in the adrenal gland. These findings can sometimes be detected through an abnormal appearance of the adrenal glands, and can often be indicative of a more aggressive form of the disease.","Cystic pheochromocytoma is a rare tumor of the adrenal gland that can present with a number of different symptoms, including hypertension, palpitations, chest pain, and headache. It can be difficult to diagnose, as the tumor can be small and difficult to see.",0.9309546947479248
"Thrips are a common pest that can be highly destructive to young peanut plants. They can be found in masses, inching their way through the foliage and causing major damage. Thrips are usually found in the soil and in places where plants are kept in a humid environment, such as outdoors.","Thrips are insects that feed on plants, primarily young peanut plants. They can cause some damage to the plant, but the damage is typically not severe.",0.9037573337554932
"Jury service is an essential part of the judicial process. It is a requirement of citizenship that all judges, prosecutors, and defense attorneys must receive jury service in order to be effective. This service is aimed at gathering evidence and eliciting opinions that can help determine an issue or person. It is an important part of the judicial process, as it is an important tool for the justice system.",Jury service is an obligation of citizenship that is essential to the judicial process. It allows citizens to participate in the judicial process and provide their opinions on cases that are being heard. It also allows jurors to learn about the law and the judicial system.,0.9576363563537598
"Some people are prone to allergic reactions to their medication. This can arise from a number of factors, from a minor allergic reaction to a serious complication such as anaphylactic shock. It is important to seek medical attention whenever possible and to make sure that the medication is used in accordance with the manufacturer’s instructions.",Some people can have an allergic reaction to the medication even if they have taken it before.,0.721289873123169
"Some organic materials are often composed of a mixture of various substances, such as proteins, sugars, carbohydrates, lipids, and other similar elements. These organic materials are called organic compounds and can be found in almost any part of nature.","Some organic materials are compounds of carbon and hydrogen, such as methane and water.",0.7877489924430847
"Private agencies cover employees, families and individuals.","Private agencies provide a wide range of services to employees, families, and individuals. These services can include insurance, benefits, and retirement planning. Some private agencies also offer specialized services, such as disability insurance or cancer care.",0.7642278671264648
"Most pediatricians routinely screen children for eye abnormalities during well-baby examinations. During this screening, the doctor examines the child’s eyes, checks for dark circles, puffiness, and other eye abnormalities, and then writes an X-ray or other X-ray. If the child has any of these abnormalities, a well-baby examination is recommended.",Most pediatricians routinely screen children for eye abnormalities during well-baby examinations by performing a dilated eye exam.,0.8722778558731079
"Many girls lose their hymen as children in accidents, playing or masturbating.","Most girls lose their hymen as children in accidents, playing or masturbating. Accidents include falls from a height, bike crashes, and other physical activity. Masturbation includes using fingers, sex toys, or other objects to stimulate the genitals.",0.9409719705581665
"Digongs have a forked tail, which is similar in shape to that of a whale's. Manatees have a paddle-shaped tail.","Dugongs have a forked tail, while manatees' tails are paddle-shaped.",0.9197101593017578
"Hose is an expression of an object's being tangible and permanent. It is used to describe a physical object, such as a hose.","A hose is an object that is used to convey water or other fluid substances. It is usually made of rubber, plastic, or metal and has a nozzle at one end.",0.8711985349655151
"Therapeutic abortions are induced abortions, as they are performed to provide relief from pain or illness. They are performed in order to obtain a fetus from the womb alive and capable of producing life. These abortions are not generally a successful option, as they can lead to complications, such as fetal abnormalities and death.",Therapeutic abortions are abortions that are done for the purpose of relieving a woman's physical or emotional pain or suffering.,0.8923999667167664
All turnips have a snowy white flesh.,All turnips have a white flesh that is covered in a thick layer of snow. This gives the turnip a delicious and fluffy texture.,0.8298163414001465
"No matter how much you try, you can't break an digit.",Nought is a digit. It is not a number because it cannot be divided by any other number.,0.5782148838043213
Caffes have sections.,"In general, cafes have several different ""parts"" where customers can sit and enjoy their drinks or meals. Some cafes have a large part where people can sit and talk, while others have separate sections for people who want to read newspapers or work on laptops. There are even cafes with separate sections for smokers and nonsmokers.",0.4485449194908142
"Photographers have a long history of working for themselves, as it was a common practice for them to share the costs and profits of their work with customers, who in turn could then use the money to fund their own projects.","The history of photography can be divided into two main periods: the early period, when photographers worked for themselves, and the later period, when photography became a profession. During the early period, many photographers worked as part of a studio system. They would receive orders from customers and then would have to follow the specific instructions given to them by their clients. This type of system was very limiting, since photographers were not able to create their own unique style. The later period saw a shift in the way photographers worked. Now, they were able to create their own unique style and work for themselves. This allowed them to be more creative and to express their own ideas.",0.6345405578613281
"Plumbers compete in geographic markets, as they are the most competitive industry in terms of location, price, and product. They are also often the most skilled and experienced individuals in the industry, with a high chance of being able to take over a rival business.","The plumbers compete in geographic markets to attract new customers and retain current ones. They do this by advertising their services, negotiating better rates with suppliers, and providing superior customer service.",0.884596049785614
"Regular physical exercise has been linked to a safe and effective method to reduce stress, even if it's only going for a daily walk. Physical exercise is an effective way to help reduce stress because it opens up the body to the physical demands of physical activity, and it is not a very taxing activity as it is meant to be done in a comfortable, sedentary manner.",Physical exercise helps reduce stress by providing a sense of well-being and reducing the amount of time spent worrying or being anxious.,0.8620913028717041
"Spiritual leaders often have a deep understanding of the truth that they are dispensing, and they are often able to provide deep insights on a broad spectrum of topics.",Spiritual leaders have experienced things that have shaped their view of the world and have learned from their own and others' experiences. They are able to communicate effectively with others and provide guidance.,0.7916216254234314
"Depression is a mental health disorder that involves feelings of sadness, anxiety, and/or helplessness. It can be triggered by a variety of sources, including changes in mood, diet, lifestyle, and other factors. It’s often associated with poor relationships, financial difficulties, and substance misuse.","Depression is a mood disorder characterized by a persistent low mood or a feeling of sadness, loneliness, and hopelessness. People with depression may have difficulty concentrating, feeling tired, and having difficulty making decisions.",0.9155917167663574
"Correct pricing is a business decision, best made by venue operators and event promoters. They need to decide on a pricing structure that will meet their needs and expectations, and add the necessary incentives for a successful event. Pricing cannot be retroactively applied, and should be determined beforehand. Additionally, it is important for venue operators to consider the potential costs associated with the event and make a decision accordingly.",This sentence is saying that correct pricing is something that venue operators and event promoters should decide. It is best to make this decision based on the specific situation and market that the event is taking place in.,0.8305350542068481
"The most common hiding places for rabbits are within gardens, under bushes, on the ground, and in trees.",Most rabbits remain in hide places because they are afraid of predators.,0.8156840205192566
"Gold is a precious metal found in the Earth's crust. It is rare and highly valued for its beauty, its rarity, and its value as a precious metal. Gold is a noble metal, meaning that it can be treated as a pure precious metal or as a simple mordery metal. Its physical properties make it a desirable and valuable metal.","Gold is a yellow metal that is often used for jewelry, coins, and other decorative items. It is also a valuable resource for industrial purposes, such as use in manufacturing batteries and electronics.",0.8193724155426025
"Some cholesterol is necessary for cells to function. Cholesterol is a lipids found in foods such as dairy, eggs and fish, which helps to regulate cell metabolism and growth. It also helps to form membranes and promote cell proliferation. Eating too much cholesterol can lead to weight gain and other health problems.",Cholesterol is a type of lipid that is needed by cells to function. Lipids are important parts of cell membranes and are necessary for the transport of chemicals and nutrients between cells.,0.7808946967124939
"Surface water can be found in many different places, ranging from rocky and sandy outcroppings to deep lakes and ponds. Some surface water may also flow in the ground, such as in aquifers and soil. Other surface waters may also flow through rivers, streams and oceans, depending on the environment.","This statement means that some water flows on surfaces, such as the ground.",0.5907551646232605
"In the final weeks of life, people often focus their minds and hearts on the meaning and significance of the experience. They may reflect on the past, contemplate their present, and reflect on the present. This process of reflection allows people to more fully appreciate the beauty of the present moment and to gain a better understanding of their lives.","People often focus inward during the last weeks of life as they near the end of their life. This is due to the fact that people are more likely to focus on their own thoughts and feelings during this time, rather than on the thoughts and feelings of others.",0.6566482186317444
"Streaks are known as ""flashs"" in the scientific literature.","""Streaks are flashes of light that occur when an object moves quickly across the observer's field of vision.""",0.6326054930686951
"Handmade beads are miniature sculptures that can be used to decorate objects; they are made from a variety of materials and are not often found in larger quantity. Handmade beads can be used to add a personal touch to any piece of jewelry, while also being useful for ornamentation.","Handmade beads are often considered miniature sculptures because of the intricate detail and intricate work that goes into making them. Additionally, many people appreciate the aesthetic value of handmade beads, which can be used for ornamentation or as a decorative addition to clothing.",0.9388571381568909
"Explosives are used for kill. They are an important component in many battlefield operations, and they are often used to take out targets with little or no human intervention. Explosives are typically deployed by civilians or armed forces in the line of duty, and they can be used in both urban and rural areas. They are an important component of many military operations, and they are the mainstay of modern warfare.",Explosives are used to kill people.,0.802466869354248
"Densities, or the amount of materials per unit area, is a measurement of the total amount of material that can be contained in a given volume. The densities of materials such as dust, sand, and water are important factors in determining the amount of material that can be contained in an area.","What do densities show? Densities show the distribution of features or values per unit area. Densities can be used to describe the shape, size, and distribution of features in a sample.",0.6474788188934326
"Cotton can absorb water and lead to more dryness of the hair. This is because water tends to evaporate from the cotton and can become trapped in the hair, which can lead to a buildup of moisture. Cotton also has a very low water content compared to other fibers, so it does not absorb water like other materials. This can lead to more water being trapped in the hair and more moisture being found in the hair.","Cotton is a fabric that absorbs moisture, which can lead to more dryness of the hair because the moisture is not being distributed evenly.",0.9138858318328857
Some humans engage in activities with chimpanzees.,Some humans work with chimpanzees to study their language and cognitive abilities.,0.7727306485176086
"Cycads are a type of succulent. They are typically found in the coastal and coastal regions of North America. They are the largest known succulents, growing up to 7 meters tall. They are a member of the Cycadaceae family, and are the largest succulents in North America. Cycads are white-green, and have a thick, silky-soft skin. They are typically found in coastal and coastal regions, and are often found growing in moist, sandy soil. They are also known for their ability to produce large quantities of chlorophyll when they are stressed. Cycads are also known for their ability to produce a wide range of medicinal plants, including ginseng, ginger, and yarrow.",Cycads are a type of succulent that have a rosette of leaves at the base of a stem.,0.7609438300132751
"Chinchillas tend to have tails, but they are not always present in all chinchillas. It is not known what makes some chinchillas tails, but they are usually smaller than others.","Chinchillas have long, thick tails that they use for balance and to help them move quickly and easily.",0.7871969938278198
"Port wine is one of Portugal's most famous and renowned wines, and it is estimated that about 6 percent of the wine produced in the country is made from Port wine.","Portugal's best known wine, port, represents about six percent of the wine production.",0.9311056137084961
"Each human being has a personal and unique mission in life. From the moment of conception, through early learning, through adolescence and adulthood, human beings are constantly dedicated to fulfilling their purpose and mission. Every human being has a unique purpose, and it is this purpose that guides them in their journey.","Every human being is born with a unique purpose and mission in life. This purpose and mission is determined by what is called the ""life plan."" The life plan is a set of goals and objectives that a person has chosen for themselves. It is through achieving these goals and objectives that a human can live a fulfilling and fulfilling life.",0.7442324161529541
"Rotational transformation is a transformation in which the object is rotated about its original, geometric origin. This rotational shift is usually accompanied by changes in its physical properties such as its rotation speed and angular momentum.","Rotating an object refers to turning it around its axis of symmetry. In physics, an object is said to be in rotation if it has a definite axis of rotation and if its orientation changes as a result of the rotation.",0.7527583837509155
"Maps are representations of reality that use symbols to communicate abstract concepts. They can be used to represent aspects such as elevation, terrain, and climate. They can also be used to represent locations and major events in order to create a sense of reality. Maps are also used in navigation and navigation systems, as well as in advertising and marketing.","Maps are abstractions of reality that use symbols to represent real features on Earth's surface. For example, a map of the United States might use symbols to represent states, rivers, and mountains.",0.9227020144462585
"Silicone is highly porous to helium, as it has a diameter of around 270nm. This means that it is highly permeable to helium and can absorb up to 270 times its volume of the gas when it's in a single crystal. Silicone is also very thin and lightweight, making it ideal for use as a communication device. It is also very water-resistant, making it a great choice for medical devices.","Silicone is a type of polymer that is not as strong as other types of plastics and can be punctured by helium, a type of gas.",0.8128039240837097
"Hormones are the main source of growth in mammals. They stimulate the growth of cells and organs, such as bones and eyes, and help to regulate the body's metabolism. Hormones also influence the makeup of the body and the way it functions, influencing how the body functions, including how it functions in the environment.",Most hormones promote growth by helping the body to build new cells and tissues.,0.821146547794342
"Smoking is a factor in the development of heart disease, as it can increase the risk of developing the disease. Moreover, it can also lead to other health conditions, such as lung disease, cancer, and stroke. Research has shown that smoking is associated with an increased risk of heart disease, and it is important to limit the amount of time and tobacco use of those exposed to the smoke.",Smoking can increase the risk of heart disease by increasing the amount of cholesterol and other harmful substances in the blood.,0.8663471341133118
Shepherds had (their) corpus.,"""The shepherds have a part of their body that is shaped like a human torso.""",0.5131789445877075
"The mediocre often use the term ""luck"" to describe their ability to achieve great things. This is an example of how the mediocre approach success and achieve great things despite not having the true potential of a genius.","In general, people who are mediocre think that luck is responsible for the accomplishments of genius. This is because most people who are mediocre don't have anything to compare themselves to. They can't understand how someone could be so successful without working hard for it.",0.870949387550354
"High levels of caffeine, sugar and other chemicals can interfere with the body’s natural ability to metabolize food and fluids, leading to fatigue, irritability and dizziness.","The high levels can cause fatigue, irritability and dizziness because they can affect the body's energy levels.",0.6814199686050415
