model_sentence,curie_sentence,semantic_score
"Social support is a complex psychological, emotional and spiritual experience that can shape a person's perception of their life, relationships, and overall well-being. It can also be used to help people to cope with stress, depression, and anxiety. Additionally, social support can help to promote healthy relationships and enhance self-esteem.","Social support refers to the emotional, financial, and practical assistance people receive from family, friends, and other social networks. It is a complex psychosocial variable because it can affect people's health, well-being, and ability to cope with stress.",0.9117666482925415
"Sanctification is the essential counterpart to justification, or the forgiveness of sins. It is the restoration of the soul's innermost being and the restoration of the divine nature to its source. Sanctification is the divinely ordered process of turning the sinner into an instrument of mercy, so that the sinner can be reconciled with God. It is the work of God as the satisfaction of his people for their sins and as the expression of God's mercy. Sanctification is the central issue of faith, and is the privilege and reward of those who have been reconciled to God and have accepted his will as the only true and perfect reality. Sanctification is the required and only acceptable outcome in the process of reconciling the sinner to God.",Sanctification is the process by which a person is made holy. Justification is the act of declaring someone righteous in the eyes of God. Sanctification happens when God removes all sin from a person's life and makes them righteous.,0.8669630289077759
The structure of monocylic and diacylic calyces has two rows and three rows.,"Monocylic calyces have two rows, while dicyclic calyces have three rows. Monocylic calyces are shaped like a doughnut, while dicyclic calyces are shaped like a Hershey's Kiss.",0.751358151435852
"A slicker is someone who is better at doing something than others, especially when it comes to complex tasks.","A welcher is a slicker of water, typically used to clean a fish or other aquatic creature.",0.39006173610687256
"Hormones are a group of chemicals that play a critical role in our everyday lives. They can affect our bodies in many different ways, from our mood to our physical health. Them being involved in our lives can have a wide range of effects, from boosting our immune system to curbing our appetite. Hormones can also affect our mental health, from causing us to feel anxious to boosting our thinking skills. All these effects are key factors in the development of each individual, and it is important to be aware of how they interact and how they can be changed.","Hormones have a variety of different effects on the body, depending on the hormone and the individual. For example, testosterone can increase muscle mass, while leptin can decrease appetite.",0.6211113929748535
"Stress can cause hormone imbalance, which leads to fibroids, a potentially life-threatening issue.","Stress can cause hormone imbalance and make fibroids worse because it can affect the body's production of certain hormones, which can in turn cause the growth of fibroids. Additionally, stress can lead to an increase in the production of cortisol, which can damage the uterine lining and make fibroids worse. Finally, stress can also increase the risk of developing other health problems, such as depression, which can make fibroids worse.",0.8839617967605591
"During the organism's life span, modifications occur, which are passed on to their offspring. These modifications can be physical, like visible changes in the organism like changes in the structure of the body, or directly metabolic, like changes in metabolism. In the case of changes in the organism, these modifications are either inherited through the generations or are done by the organism itself.","Modifications that occur during the lifespan of an organism are passed on to their offspring. These modifications can be either genetic or environmental. Genetic modifications are passed on from parents to their offspring through the transfer of DNA, while environmental modifications are passed on through the exposure of the organism to certain chemicals or radiation.",0.8434562683105469
"Children are unique and have a unique and unique personality. They have the ability to have unique thoughts, beliefs, and views, making them different from other people. They are also very creative and have a great sense of observation and creativity. They can also be very independent and independent-minded as they are very independent minded and have a great sense of self-reliance. They also have a great ability to be creative and have a great ability to think outside the box.","Children have very small bodies and minds, making them very unique. They are constantly growing and learning, so their personalities are constantly changing.",0.7445024847984314
"Elephants are highly charismatic creatures that can be seen for miles and are often seen in the wild. They are known for their lively disposition, their ability to easily mark their path, and their ability to make enough noise to alert other animals. Elephants also have a unique ability to communicate with each other in a variety of ways. They can communicate through song and sound, mimic other animals, and even use their communication skills to gain intel on their environment.","There are many things that make elephants charismatic creatures. They are large, impressive, and have a long history of being respected and feared by many. They are known for their intelligence and memory, and many people believe that they have a strong connection to the spiritual world.",0.8228814601898193
"Compacting grains creates a more tightly packed arrangement. This is because the grains are squeezed together more tightly when they are compressed, resulting in a more tightly packed arrangement.","Compaction produces a more tightly packed arrangement of grains, which in turn leads to a more stable and durable product.",0.836664080619812
"Reed's work is focused on reconstructing environments that surrounded early humans, such as the environment they lived in and the kinds of resources they had access to. He seeks to uncover the ways in which these environments could have influenced their behavior and behaviors in the future. He is trying to uncover the patterns and relationships between them and explore how the environment affected their life choices.",Reed reconstructs environments that surrounded early humans by studying archaeological evidence and conducting field work.,0.7071501016616821
"Flowers are much larger than leaves, as the larger size of the flowers indicate a more delicate and delicate structure. To explain, the flowers are usually larger than the leaves, as leaves are often more dense and curvaceous in their shape.","The flower buds are much larger than the leaf buds because the flower buds are filled with water and nutrients, while the leaf buds are not.",0.8038779497146606
"An oncogene is a genetic condition that can cause cancer. It belongs to the group of genetic diseases called oncogenes, which are characterized by abnormally abnormal growth and or abnormal cell growth. It can lead to various symptoms and can be inherited, meaning that people with the same genetic condition can be affected by the same symptoms. Oncogenes can also cause tumors to develop and can be passed from one generation to the next.","There is no one answer to this question since oncogenes can have many different definitions. However, in general, oncogenes are genes that can cause cancer. They can be inherited or can be created through the use of radiation or other chemicals.",0.8743963241577148
Sharks are found in coral reefs and other marine environments.,"Sharks are located in reef habitats. Reefs are marine environments that are found near the coast and consist of a coral reef and its associated marine life, such as fish, coral, and seagrass.",0.9115397930145264
"Oceans are defined as contiguous land areas that are surrounded by water, forming a closed system. Oceans are constantly being created and destroyed, and the amount of water flowing around the world is constantly changing. The planet's ocean is a dynamic and never-ending sea, and it is the home to many different life forms and ecosystems.",Oceans are located in motion because they are constantly moving. The Earth's oceans flow in all directions and are constantly moving due to the Earth's rotation.,0.6517521142959595
"Fruit is a nutlet enclosed in a papery cone, which is a type of fruit body usually containing seeds. It is a vegetable-like food source that is often used to make jams, chutneys, and other foods.",A fruit is a nutlet enclosed in a papery cone. Fruits are typically soft and have a sweet taste.,0.8823488354682922
Winter days can be cold and often plunge below zero.,Winter days are cold and evening temperatures can dip below zero. This means that it can be very cold at night and even during the day.,0.7457375526428223
Some women enter unions in order to receive special protections and benefits.,Some women may choose to join unions because they believe that they can gain better working conditions and a voice in the workplace. Unions can also provide support and resources for women who are experiencing harassment or discrimination at work.,0.7774503231048584
Dogs are capable of opening doors.,Dogs can open doors because they have a strong jaw and teeth.,0.8586353063583374
"Lead poisoning can cause serious brain damage in children and even more in adults. It can be caused by the consumption of high levels of lead in drinking water, food, or other sources. The lead concentration in drinking water can lead to the formation of toxic compounds, which can lead to brain damage. In general, children and adults are more susceptible to lead poisoning than other people due to the complex architecture of their brains.",Many experts believe that lead poisoning can result in brain damage. This is because lead intoxication can interfere with the function of the brain and nervous system.,0.8218693137168884
"Begonia is a genus of flowering plants in the Asteraceae family. They are known for their small, graceful leaves, often with a single leaf blade and a slender, showy petals. Begonia has a staminate pollination system and produces white flowers from April to October. Begonia is native to the tropical and subtropical regions of the world, but it is now an endangered species due to habitat loss and overgrazing.","Begonias are a genus of plants in the Liliaceae family. They are native to the Americas, where they grow in moist areas such as streams and marshes. Many species are brightly coloured, and some are used in flower arrangements.",0.8767753839492798
"Land managers can reduce the impacts of high winds and ice by regulating stand densities. The aim of these measures is to reduce the amount of energy lost as heat, water and sound waves are absorbed by the ice and land. This can reduce the amount of energy required to produce a given wind speed and direction, resulting in a reduction in the intensity of the wind. Land managers can also reduce the amount of energy lost as air resistance and wind friction can be reduced.",Reducing stand densities can help reduce the impacts of high winds and ice by regulating the number of trees per acre.,0.6723911166191101
"Periodic drought can have a serious impact on the environment, as it can cause damage to plants and animals through reduced water availability, reduced nutrient levels, and reduced sunlight.","A periodic drought is a drought that occurs on a regular basis. This can have a significant impact on the ecosystem, as well as the livelihoods of the people who live there.",0.8606138229370117
"Most people are drawn to the person-oriented aspects of their world and are interested in the way that others think, feel, and behave. Round eyebrows reflect this interest, as people who have them tend to be people-oriented and seek to gain insight from others.","Some people with round eyebrows may have a tendency to focus more on others than on themselves, which can lead to better relationships and overall well-being. In addition, people with round eyebrows often have a softer appearance, which can make them more approachable and likable.",0.8682032823562622
"Immunochemistry is the study of the interaction between the body's immune system and foreign substances. It is the study of how foreign substances can interact with cells or tissues in the body, leading to the development of protective immunity.",An immunochemistry is the study of the chemistry of the immune system. Immunology is the study of the biology of the immune system.,0.8507858514785767
"Water transportation is still the most efficient way to move bulk goods due to its convenience, low shipping costs, and fast arrival times.","Water transportation is still the most efficient way to move bulk goods because it is a reliable and environmentally friendly mode of transport. Compared to other modes of transport, water transportation is also the cheapest and quickest way to move goods.",0.9495866298675537
"The stability of a beam and the bottom shape are both dependent on their length, but they are also influenced by their width. For example, a standard beam with a shallow bottom may not be as stable as a wider beam with a deeper bottom due to its narrow width. This is due to the fact that the width of a beam is limited by the width of its base, while the width of its bottom is limited by the depth of its base.","Stability is primarily a function of beam and bottom shape, but it is also affected by the length of the boat. The longer the boat, the more stable it will be. Beam, bottom shape, and length are all important factors in boat stability.",0.7435907125473022
"The number of diagnosed breast cancer in the United States has more than doubled since 2000, with current estimates of about 1 in every 10 women diagnosed with the disease. It is the most common form of cancer, affecting more than half of all women in the United States. It is predicted that by 2040, there will be over 6 million diagnosed with the disease.",The most commonly diagnosed cancer in the United States is breast cancer.,0.7617937326431274
"Snow can cause accidents if it is not properly cleared, deflated, and removed before it is used for other purposes.",Many accidents are caused by the snow because it is difficult to see.,0.7351542711257935
Archery is an Olympic sport second only to golf as one of the most popular sports in the world. It is a sport where players use their skills to shoot arrows and arrows at targets with precision and accuracy. Archery is also a great way to develop teamwork and coordination.,Archery is an Olympic sport because it is one of the oldest Olympic sports and it is a physical activity.,0.892869770526886
"Nations rely on efficient technology for many of the activities that they do, such as communication and transportation. Governments use technology to instill a sense of safety and security in their citizens, as well as to facilitate economic development. Technology can also be used to enhance the communication and collaboration between different organizations, providing a better sense of cooperation and collaboration between parties.","Nations use efficient technology to improve their productivity, economic growth, and overall well-being. They use efficient technology to improve their infrastructure, to monitor and manage their resources, and to protect their citizens. Inefficient technology can lead to unreliable systems, wasted resources, and compromised security.",0.8458063006401062
"Cycads are a type of flowering plant, and they are a source of materials used in the making of ornamental plants. They are also used in medicine and food, as well as in traditional crafts such as weaving and embroidery.","Cycads can provide a variety of materials, including thatch, food, medicines and ornamental plants. They are also known for their resistance to drought and high temperatures.",0.8320208787918091
"Some experts have found that deep sleep deprivation can lead to cognitive and physical impairments, including the inability to remember details, focus, and recall information. Deep sleep deprivation can also lead to a decrease in the ability to learn new skills, as it prevents the body from quickly returning to its usual state.","Some experts report that deep sleep deprivation impairs the brain's ability to process information, leading to decreased productivity and decreased IQ.",0.8030608892440796
"The theater critic is a person who critically reviews plays, musicals, and other works of literature. They are often outspoken and opinionated, and often have a strong opinion on a particular play or musical.",A theater critic is someone who reviews theater performances. They may write about the theater itself or the performance itself.,0.9071745276451111
"Mesophilic culture is a culture that is characterized by an affinity for the flavors of baking and baking soda, while using baking soda or baking powder instead of mesophilic culture is a cultural preference. The composition of the buttermilk is often clarified with a liquid like cream or milk, and is then fermented in the presence of a liquid like beer or grape juice for a variety of flavorings.","Buttermilk is a type of milk that is produced by fermenting cream with buttermilk culture. Mesophilic cultures are cultures that are found in warm environments, such as a kitchen.",0.7457314133644104
"Copper collages are made from galvanized and copper-coated metal sheets, commonly urethane, for use as decoration or packaging. These collages typically have a unique look and style and are commonly used as a visual accent.","This sentence is about a series of copper collages made from industrial materials, specifically galvanized and copper. The artist uses these materials to create an interesting and complex series of works.",0.6563442945480347
"Deforestation results in the destruction of natural ecosystems that are essential for the functioning of the planet. This is because the photosynthesis that plants require to survive becomes disrupted by the loss of forests, leading to diminished levels of oxygen in the atmosphere. Deforestation also reduces the amount of carbon dioxide that is released into the atmosphere, which contributes to global warming. Additionally, it can also have other negative impacts, such as increasing water pollution, soil erosion and the spread of invasive species.",Deforestation is the removal of trees from an area. This can be done by humans or animals. Deforestation contributes to global warming because the trees that are removed from the Earth release carbon dioxide into the atmosphere. This gas is a greenhouse gas and helps keep the Earth warm.,0.8328602313995361
"Some chemicals can have a wide range of effects on humans, ranging from no effect to potentially life-threatening effects. These effects can be caused by a variety of sources, such as exposure to air pollutants, chemicals, and industrial waste.",The sentence is incomplete. It needs to state what kind of chemicals.,0.5068944096565247
"This is true of all mammals, including whales, reindeer, and elephants. They have poor color vision, as they cannot see colors in the ultraviolet and infra-red wavelengths. Mammals can only detect the black and white visible wavelengths of light. This lack of color vision is a major problem in many habitats where they are found.",Mammals have poorer color vision than many other animals. This is because they have less light-sensitive cells in their eyes than other animals. This means that they are not able to see as well in color as some other animals.,0.8367484211921692
"Some bowerbirds have an obsession with one particular color or another, such as red or yellow. They tend to choose one color over the other more often than not, and these birds often find themselves out of reach of other bowerbirds that are more suited to other colors.",Some bowerbirds prefer to build their nests in trees with high branches.,0.5992415547370911
"Mice create holes by moving their legs and feet in different patterns, like a fan or a wave. They are also known to dig holes through the ground, even from a great distance.","Mice create holes by gnawing through the wood of a log or piece of furniture. They do this in search of food, which they find inside the hole.",0.8155203461647034
"Clinical dietitians work in hospitals and nursing homes to help patients meal plan, prepare meals for themselves and their family, and manage their dietary weight.",Clinical dietitians work in hospitals and nursing homes to provide nutrition counseling and support to patients. They may also work with the hospital's food service staff to develop and implement dietary plans for patients.,0.9660956263542175
"Web pages are typically text files marked up by HTML tags. HTML tags are used to style and format the code within a web page, while CSS styling is used to hide or show elements within a page. HTML tags can also be used to label elements and customize the appearance of the page.","A web page is a text file marked up by HTML tags. These tags tell the browser how to display the text on the page. For example, <a> tags indicate where an anchor (a link to another page) should be placed, and <p> tags indicate where text should be placed in the paragraph.",0.8248682022094727
"Extracellular digestion is the process by which organisms, including humans, break down food into smaller units. It is generally very common in mammals, such as humans and some other animals, such as rodents and pigs. Extracellular digestion is characteristic of the largest classes of organisms, including mammals, and is associated with adaptations to food storage and digestion. Extracellular digestion is also a key step in the process of growth and development.","Extracellular digestion is the process by which food is broken down into smaller molecules outside of the cell. This is more common in mammals, including humans, because these animals have more complex digestive systems.",0.9253584146499634
"It is an important skill that can be learned and improved upon. It requires being able to easily and quickly identify and master new tasks, processes and ideas in order to reach a higher level of efficiency.","The efficiency of a task can be improved through practice. Efficiency can also be learned through various methods, such as books, articles, or online courses.",0.679927408695221
"Floodplains are naturally designed to store and store away flood waters, providing protection from water hazards. Floodplains are an important part of the hydrologic cycle and provide home to many organisms and their ecological communities. Floodplains are also important for aquatic life, providing habitat for many species of aquatic life.","Floodplains are nature's storage area for flood waters. This is because floodplains are low-lying areas that are often subject to flooding. Floodplains are also rich in organic matter, which helps to soak up water. This makes them ideal locations for storing flood waters.",0.8906292915344238
"Mules are also known as horses, horses, and ponies. They are a type of large, hoofed animal with a long and slender tail. Males are larger and more powerful than females, while ponies are smaller and less powerful.",Mules are a hybrid animal that come in both male and female forms.,0.7935216426849365
Docs have a part cytoplasm.,Cytoplasm is the fluid that makes up the cell's nucleus and other organelles.,0.5589799880981445
"Swedish antiques are also in demand abroad, as well as other historic and decorative items.",Swedish antiques are in high demand both domestically and abroad. This is due to the high quality of the workmanship and the innovation of the designs.,0.8683485984802246
"Copper is the most effective way to kill algae in swimming pools because it is a mild, inexpensive and effective way of killing them. Copper ions can penetrate the algae's protective layer and penetrate to the root zone, where the algae can die down and die, thus reducing the chances of the algae being able to survive and grow. Copper is also a naturally occurring metal that has been associated with high efficiency of killing algae.",Algae can get in the swimming pool through the water lines or through the filter. Algae can also get in the swimming pool through the soil. Copper is the most effective way to kill algae in swimming pools because it kills the algae from the inside.,0.8940462470054626
"Language differences can be caused by the way different languages spell words. For example, the English word ""monkey"" is spelled differently in Portuguese, Spanish, and Swedish.","Different languages map the pronunciation of a word onto a letter of the alphabet. For example, in English, the word ""bat"" is spelled with a t in the middle because that is the letter t that corresponds to the pronunciation of the word ""bat.""",0.55792236328125
Profit is the accumulation of gain over time. It is the accumulation of an individual's individual gains over a certain period of time. Profit is often expressed as a percentage of a company's total profits. It is a useful concept to understand when comparing different companies.,"This sentence is a definition of the word ""profitability."" It means that profitability is a measure of how much a company is making from its operations.",0.6656075119972229
