model_sentence,curie_sentence,semantic_score
"Saddle soap is used for cleaning, conditioning, and softening leather, and is also used in leather finishing and textiles. It is a solution of soap, water, and a small amount of salt that is mixed with a liquid to create a mild-tasting solution. This solution is wound into a cloth, then brushed or soaked in water to clean and soften the leather. The soap helps to soften the leather and make it more comfortable.","Saddle soap is a soap made for cleaning, conditioning, and softening leather. It is made with a blend of oils and butters that work to remove dirt, oil, and grease from the leather.",0.9375383853912354
"The Paramecia regulate water by way of contractile vacuoles, which are vacuoles within the body cavity of the paramecia, to regulate the forces that govern the body and its environment. These contractile vacuoles act to push and pull fluids within the body, allowing the body to move while maintaining a steady state.","Paramecia regulate water by way of contractile vacuoles. These vacuoles can contract and expel water, which helps the paramecia to stay submerged in water.",0.8894400596618652
"Fireworks are particularly dangerous when they contain gunpowder. Gunpowder is toxic and can cause serious burns, as well as other effects, such as death and serious injury. Gunpowder can also cause an explosion and damage to buildings, cars, and other objects. Furthermore, firework explosions can be hazardous to workers, especially when they are involved in the process of shooting.",Fireworks contain gunpowder which is a chemical that can easily cause a fire.,0.7949251532554626
"Predatory birds use their knowledge of the ground cover to stalk and kill prey on the reed beds. This knowledge allows the birds to adjust their tactics to better catch and kill prey. They also use their wings to fly high in the air and circle and capture fleeing birds, which is an effective technique for capturing and killing predators.",Predatory birds hunt the reed beds for mammals and other birds that shelter there because they believe that these creatures provide them with food.,0.7740404009819031
"The most popular cold cuts, such as tuna, ham, and cheese, have a comparatively high fat content compared to their healthier counterparts. Furthermore, the fat content of these dishes is often higher as they are often made from higher-calorie meats.",Most cold cuts are high in fat and sodium because they are made from raw meat. These types of cuts often contain a lot of unhealthy fats and sodium.,0.7805672883987427
Address books are found in suitcases.,Most people keep their address books in a suitcase so that they can easily access them when they travel.,0.8511258363723755
"This sentence is referring to the phenomenon of ""absorption"" – when light is absorbed by a material, it is then lost as heat energy, leading to a reduction in intensity of the light. This is why dark colors are often used in lighting, as they are able to absorb light and allow more light to pass through them. Furthermore, the higher wattage of a bulb is required to achieve the same amount of brightness in the dark.","Dark colors absorb light more than lighter colors, so they require higher wattages to light.",0.6664741635322571
"Abortion rights is a national issue with wide-reaching implications. It is a human right, calling for an acknowledgment from all sides that abortion is a moral and legal issue that applies to everyone. Abortion is a fundamental right, and all people should be able to make their own decisions about the procedure. This issue is a matter of human dignity, and it is essential for people to have the capacity to make their own decisions and make their own decisions based on the facts and evidence.","Abortion rights is a national issue that should be brought up by everyone, regardless of their stance on the matter. Abortion is a human rights issue that needs to be discussed and brought to light in order to protect the rights of all people involved.",0.9016513228416443
Most people experience an increase in fatigue after radiation therapy.,Most people feel tired after radiation therapy because it drains energy.,0.8739193677902222
"Similes are often used in stories to contrast two points of view, create an atmosphere of mystery, and create a feeling of suspense. They are used to express emotion and make the reader feel connected to the character. Similes can also be used to represent specific things, such as mountains and rivers, that are too large to be seen from the ground.","A simile is a figure of speech that compares two unlike things. They usually involve a verb and a noun, and the verb typically describes the action of the noun. For example, ""John is as tall as a tree"" would be a simile because the verb describes John as being like a tree.",0.7682704925537109
"Some girls notice changes in their physical and emotional health during their menstrual cycles. They may notice fatigue, moodiness, and feelings of sadness or anxiety. These changes may not be apparent immediately, but they can become more apparent as the menstrual cycle progresses.","Some girls notice that their emotions are more intense and that their mood swings are more pronounced during their menstrual cycles. Some girls also notice physical changes such as cramps, heavier periods, and acne.",0.8903127908706665
"Carbuncles are an abnormal condition caused by mutations in the bacteria that produce the fatty acids that make up the collagen found in the body. Carbuncles are caused by mutations in the genes that code for proteins that can make the fatty acids. The symptoms include anemia, fatigue, and weakness. Carbuncles can also cause other health problems, such as esophageal and renal complications.","Carbuncles are inflamed, pus-filled lesions that develop on the skin around the neck, armpits, and groin. They can be caused by a variety of infections, including strep throat, herpes, and human papillomavirus (HPV).",0.7063846588134766
"Coral reefs are found throughout the tropical oceans and are an essential ecosystem component of the marine environment. They are responsible for providing food, oxygen, and other resources to the marine ecosystem.","Coral is found in warm, tropical oceans all over the world.",0.7115497589111328
"Glycolysis has two steps: First, the enzyme dehydrogenase forms a complex with coenzyme A and NADPH to form an ATPase. Second, the ATPase cleaves the hydrophobic acceptor, C-type lectin, and releases a specific molecule of C-terminal C-DNA sequence. This structure together with the other enzymes in glycolysis catalyzes the formation of a series of products, ultimately leading to the production of energy.",The two steps in glycolysis are the conversion of glucose-6-phosphate to glucose and the conversion of glucose to pyruvate.,0.7209582924842834
Dogs are shedding.,"Dogs are shedding hair in order to keep themselves clean and healthy. This is a natural process that occurs in all animals, including humans.",0.7425066232681274
"Concept maps are designed to illustrate how information is organized. They are often used to create clarity and to make information more easily accessible. By visually illustrating the organization of information, they are an invaluable tool for helping users to understand the main points of a project or website.","A concept map is a graphic illustration that shows how information or concepts are organized. Concept maps can be used to help students understand complex information or to present ideas in a visual way. Concept maps can be created using a variety of different tools, including drawing software, word processors, and online mapping tools.",0.9459441900253296
"Some runners may have shoes that have heels, as there are a variety of shoe options and foot sizing depending on the runner's foot size.",Some shoes with heels are designed to make you taller. Heels make you more stable on your feet and can make you more efficient in your running.,0.7978768348693848
"Depression can have a devastating impact on one's recovery from heart disease, as it can interfere with physical and mental functioning, impair physical health, and decrease motivation and energy levels. In addition, depression can inhibit the ability of heart patients to safely exercise and helps to reduce the number of heart attacks.","Depression can impact a person's ability to recover from heart disease in a number of ways. For one, it can make it harder for a person to cope with the stress of heart disease treatment. It can also lead to a decline in physical activity, which can increase the risk of developing heart disease in the first place. Finally, depression can make it harder for a person to focus on their health and recover from heart disease.",0.9355313181877136
Some shoots grow from kernels.,"""Some shoots grow from kernels."" The word ""shoots"" refers to the plant's growth. The word ""kernels"" refers to the seeds that are inside the fruit.",0.803302526473999
"Investigations lead to insights. By uncovering new information and gaining insight, we can gain a better understanding of the world and make more informed decisions about our business. Investigations also help us to identify potential problems and fix them, which helps us grow as a company. By investigating, we can also identify potential opportunities and develop new solutions.","Investigations contribute to knowledge in a number of ways. They can help us to understand a situation better, to develop new theories, to find new evidence, and to make better decisions. In addition, investigations can help us to protect ourselves and to ensure that the rights of others are protected.",0.834630012512207
"Police departments are funded through public money, which is available from the public as a source of funding. This means that police departments are not beholden to any particular person or entity, and can only take steps to protect the public, such as investigating crimes or patrolling the streets, if they are funded by the public.",Public agencies are organizations that are funded by the public. Police departments are public agencies because they are organized and operated to protect the public from crime and enforce the law.,0.7613636255264282
"Oral sex is one of the most common sexual expressions, having been practiced for millennia. It is a combination of the oral, body, and hands-on, allowing for a variety of activities, from masturbation to intercourse. It is also an effective means of communication and can be used as a way to explore our body and explore the feelings of others in intimate ways.",Oral sex is a way of sexual expression that is often done with someone you are attracted to. It is often seen as one of the most intimate ways to have sex.,0.9067672491073608
"Alligators frequently prey on smaller species than their own size, as they can easily outnumber them. Alligators are stockfish-type species, meaning they are born as adults and they live their whole lives without any predators.",Alligators commonly prey on species that are smaller than their own size because they can easily overpower their prey.,0.8823723793029785
"Evolution is a process of change. It is a process of uniformity, proceeding at different rates in different structures. Different structures have different levels of modification, and therefore different evolutionary paths can lead to different outcomes.","Evolution is mosaic in character, proceeding at different rates in different structures. This means that some structures, like the brain, evolve more quickly than others, like the spinal cord.",0.6268355250358582
"Many countries encourage singles to adopt. They see it as a way to help them reach their potential and build strong social relationships. In addition, many countries have laws that help facilitate adoption through subsidies and grants. In many countries, there is also a need for a certain type of person to adopt a particular gender/gender identity. In some countries, there are laws that mandate certain pre- adoption procedures and require that certain individuals have certain medical test results.",Many countries encourage singles to adopt because it is a way to reduce the number of orphans and increase the number of families.,0.8410863876342773
"Some bass has fins, which are small fins that enable it to move back and forth in water.",Some bass have fins because they live in the water.,0.8763577342033386
"Japanese encephalitis is the most common form of infectious cardiovascular disease (ICD-9 code: 100-999). It is caused by the Japanese encephalitis virus and is the most severe form of the disease. It is most commonly encountered in the country's main island, Hokkaido. The virus can also spread through airborne transmission, although the risk is greater for longer distances.","Epidemic viral encephalitis is a serious and potentially fatal disease caused by a variety of viruses. Japanese encephalitis is the most common form of epidemic viral encephalitis in the world. It is most commonly spread through the bite of an infected mosquito, and can cause a wide range of symptoms, from mild, flu-like symptoms to severe, life-threatening illness. There is no specific treatment for Japanese encephalitis, and it can be fatal in up to 50% of cases.",0.6897648572921753
"Some marine animals derive from stock, which is the product of a previous species’ evolutionary history. The base of the species is essentially the same, with its characteristics and physiology being similar. This means that the species may have changed its genetic makeup over time and still have the same physiological features.",The sentence is saying that the marine animals were developed from a common ancestor.,0.6102368235588074
"The visible light is scattered in two different ways as it passes through the atmosphere. The visible light is scattered in an either/or manner, in which a certain amount of light is visible in one direction, and in the opposite direction. The atmosphere is responsible for both the visible light and the scattered light, and it can provide the two different ways of light that the light passes.",Visible light is scattered in two different ways when it passes through the atmosphere. The first way is that the light is broken up into small pieces and then scattered in all directions. The second way is that the light is absorbed by the gas molecules in the atmosphere and then re-emitted as heat.,0.8548586368560791
"Justice promotes the pursuit of personal and social responsibility by encouraging individuals to strive for a just and fair outcome for all parties. It also provides a platform for individuals to reflect on their actions, prepare for possible outcomes and seek to improve their lives in the process. Justice fosters cooperation, cooperation which can lead to better outcomes for all.","Justice promotes personal and social responsibility by encouraging individuals to take accountability for their own actions, and to help ensure that everyone has an equal opportunity to participate in society. It also encourages individuals to cooperate and work together to resolve conflicts and disputes, and to protect the rights and safety of others.",0.9176584482192993
"Trees soak up and store water from season to season, slowly releasing moisture during dry periods.","Water is absorbed by trees through their leaves and is held in their cells until it is needed. When there is a lot of rain, the water runs off the leaves and into the ground. The water is then absorbed by the ground and the cycle starts all over again.",0.6623592376708984
"Other countries have different requirements for what is required for a visa, such as the length of time it is required to travel and the type of visa they require.","Other countries have different requirements for health insurance, retirement savings, and even citizenship.",0.4851492643356323
Miezcanies are galleries where works of art are displayed.,"A mezzanine is a balcony or gallery located on the second or third stories of a building, often used for storage or exhibition.",0.3298589885234833
"Dogs have a highly sophisticated and deep brain structure, which enables them to process information and make decisions. This brain structure is also responsible for making decisions and responding to emotional stimuli.","Dogs have a large and complex brain, which is why they are able to do so many things that humans can do. Their brains are also very similar to human brains in terms of size and complexity.",0.7446213960647583
"This is true of all penaeid shrimps, which have a life cycle that is characterized by changes in the numbers of their eggs. The eggs are usually laid in a tunnel, and the movements of the water around the shrimps cause them to change their shape. As the shrimps grow larger, they can move around more freely and the numbers of their eggs can increase. Eventually, the shrimps will reach maturity and complete the life cycle.",Penaeid shrimp are a type of shrimp that have a life cycle that is very similar. They undergo a metamorphosis in which they go from a juvenile form to an adult form. They then reproduce and the cycle repeats.,0.8014046549797058
"Some women produce testosterone, which is a hormone that helps to regulate body size and development. It is also believed to be a key component of the male hormones that are responsible for sex hormones.",Some women produce testosterone because they have a Y-chromosome that contains the gene that produces testosterone.,0.6833900809288025
"Psychosocial attitude is that of independence which involves the self-worth and self-confidence of one's own opinions, values, and beliefs. It requires that one have a strong sense of self-worth and confidence in order to pursue their own goals and dreams. It is also a key element of achieving self-worth and developing confidence in one's self-confidence.",The psychosocial attitude is one that is independent. This means that the individual feels self-sufficient and is not easily influenced by others.,0.843697190284729
Memory is the force that allows our minds to alter the path that we have taken. It helps us to remember what we need to remember and helps us to navigate our way forward. Memory is a powerful tool and can be used to help us to reach our goals and achieve our goals.,"Memory allows our minds to hold onto our goals and keep moving forward. It allows us to recall events from the past and use them to inform our present actions. Additionally, it allows us to store information for future reference.",0.879112184047699
"Mechanization is a condition that refers to the process of the human body functioning in a way that is not naturally or automatically programmed. It usually involves the development of new structures, relationships and behaviors in the body that are not related to the basic functions of the body. By utilizing machines and automation, humans can become more efficient in performing tasks and performing more complex tasks than they would otherwise be able to. The process of mechanization is also considered to be a ""human advantage"" in many industries, such as medicine, technology, engineering and manufacturing.",Mechanization is a process whereby machines are used to perform tasks that were formerly done by human labor. It is often used in industrial and commercial settings to improve efficiency and productivity.,0.883865475654602
Gophers are solitary and somewhat territorial. They live in small groups and will often defend their territories from other animals. They are also rarely friendly and tend to shy away from human contact.,"Gophers are solitary and relatively territorial. They live in underground burrows and typically avoid humans, although they will tolerate them if they are not bothersome.",0.9443686008453369
Technicians have the cytoplasm or membrane of the body in their hands.,Technicians have a part of their cytoplasm.,0.8008875250816345
"Sexual maturity is reached around three months of age, with most rats reaching sexual maturity at this time.","Most rats become sexually mature within three months of their birth, although some may not attain sexual maturity until they are six months old or older. Some rats may live up to one year, but the majority of them die within six months to a year due to various complications associated with being sexually active.",0.9103827476501465
"Embodiment has two necks: a front neck and a back neck. Front neck is the top part of the head and usually serves as the central part of the body. Back neck is the lower part of the head and usually serves as the lower part of the body. The front neck is usually longer than the back neck, while the back neck usually is shorter than the front neck.",One possible meaning of this sentence is that the embodiment has a neck in one or more parts. It could also mean that the embodiment has a neck that is part of its body.,0.7031229734420776
"According to the Department of Justice, black Americans make up 66.9% of the nation's total population. This proportion is higher than any other racial group, with whites and Asians making up just over half of the total population.",This sentence states that people of color comprise two-thirds of all prisoners nationally.,0.35434526205062866
"The marabou goose is a product of the chicken industry, made from eggs and meat of the goshawk.",Grizzly marabou comes from the feathers of chickens.,0.6247375011444092
"Burrows have a network of tunnels which are used for moving items, accessing communication devices and communicating with other creatures.","A burrow is a hole or tunnel that a creature such as a mouse, mole, or rabbit makes to live in. Burrows can be very simple, consisting of just a few inches of earth and a tunnel leading down, or they can be elaborate and complex, with multiple tunnels and chambers. Some burrows are deep enough that the creature can crawl inside and stay underground, while others are shallow enough that the creature can only stand up in them.",0.6614625453948975
"Sulfur has a strong, musky smell that can linger in the air for hours.","Most sulfur has a pungent, unpleasant odor that is often associated with rotten eggs.",0.7206450700759888
"Many industries are able to become more productive because of technological advancements. Technology has made it possible to automate processes, increase accuracy and efficiency, and provide new services and products that would not have been possible before. This has allowed businesses to expand, increase productivity and create more jobs. Technology has also enabled businesses to compete more effectively in the marketplace and to better understand customer needs.",Technological advancements have allowed many industries to become more productive. This has allowed for a greater level of economic growth and increased job opportunities.,0.8363710641860962
"Clouds are often referred to as aerosols because they are thin, thin-walled droplets in the atmosphere. These aerosols are responsible for the reason that clouds are responsible for the particles that form in the atmosphere, and they can be created by the release of chemical or thermal energy.",Clouds are created by water droplets that are lifted into the air by the wind. The water droplets freeze into a glycoprotein called ice crystals. The ice crystals grow until they are so large that they fall out of the sky as rain or snow.,0.7555739879608154
"Therapy involves medications that reduce the breakdown of aqueous, or parasympathomimetic substance, such as hydrocortisone, paracetamol, and ketorolac. These drugs can help reduce the severity of pain by reducing the release of endorphins and other neurotransmitters, which can reduce the pain and inflammation.","Therapy involves medications that reduce aqueous production or Parasympathomimetics. These medications work by constricting blood vessels, which in turn reduces the amount of water being produced in the body. This can help to relieve symptoms such as excessive sweating, anxiety, and restlessness.",0.6379618644714355
"A guide dog is a dog that is trained to help a person or animal in need. It helps guide the owner, the dog's handler, and other animals around by following their directions and assisting in helping the animal find their way home.",A guide dog is a specially trained dog that is used by people with vision impairment to help them navigate the world. Guide dogs are usually black or brown and are very friendly.,0.9271755814552307
"Sleep is also essential for dreaming, as it allows us to gather the appropriate levels of oxytocin, a chemical hormone that helps to promote socialization and happiness. It is also essential for the production of creativity and creativity-producing activities such as writing, painting, or creativity. Sleep also helps to regulate our emotions, making them feel more natural and less stressed. Finally, it can be beneficial for regulating our stress levels.",Sleep is important because it allows for dreams. Dreams are a way for the mind to process information and can be helpful in learning and development.,0.7855532169342041
"Lower legs have a similar shape and size, with a slightly curved shape at the end and a slightly curved leg joint. This suggests that lower legs are more likely to be similar in shape and size than upper legs.",The lower legs show similarity because they are both below the knee.,0.7142181396484375
