model_sentence,curie_sentence,semantic_score
"Hippopotamuses are a group of large, four-legged mammals that live in Africa. They are the largest land mammals and are closely related to the Asian elephant and hippopotamus. They have four legs, a head, and a trunk that are used for locomotion and for jumping. Hippopotamuses are closely related to the African wildebeest and are often mistaken for them.","Hippopotamuses are a type of mammal. They are large, amphibious animals that live in Africa and Asia. They have long, snout-like noses and are very slow-moving.",0.8696926832199097
"Central Florida has seen the highest number of lightning strikes compared to anywhere else in the United States, with an average of 5.4 strikes per year. Central Florida is the region most affected by lightning, experiencing an average of 4.5 strikes per year. Central Florida is also home to the largest population of bats in the United States, with an average of over 4.8 strikes per year.",Central Florida is the most frequently struck area in the United States by lightning.,0.8119486570358276
"The second messenger pathways involving the central nervous system are usually involved in the processing of sensory information and in the organization of behavior. This can involve the formation of associations between stimuli and behavior, suppressing or activating the second messenger functions by activating the hypothalamic-pituitary-adrenal axis.",Second messenger pathways involve the central nervous system in the transmission of information between different parts of the body.,0.833890438079834
"Life appears to cope with pressure effects on biomolecules in two ways. First, life is able to cope with the pressure of environmental conditions by using strategies such as hyperpolarization and hyperthermia to regulate physiological processes. Secondly, life is also able to use chemical reactions to regulate the environment and thus maintain a stable environment. This suggests that life is capable of overcoming the pressure of pressure for a number of different reasons.","One way life copes with pressure effects on biomolecules is by forming pressure-resistant proteins. These proteins help to protect the biomolecules from damage and can even help to increase the efficiency of the biomolecules. Another way life copes with pressure effects on biomolecules is by transferring energy from one molecule to another. This is done by using enzymes to break down the bonds between molecules, and then using the energy released to do work.",0.8502198457717896
"Bonds are registered securities backed by the full faith and credit of the United States. They are issued by federal, state, or local governments, and are backed by the full faith and credit of the nation.","Bonds are registered securities backed by the full faith and credit of the United States government. This means that the government guarantees that the bonds will be paid back, and that the bond issuer will be able to repay the money that is owed.",0.8986265659332275
"Whole food provides essential nutrients and minerals for human body, as well as vitamins and minerals. Eating a balanced diet with a variety of vitamins and minerals can help ensure that your body stays healthy and strong.",A whole food is one that has not been processed or altered in any way. These foods typically contain all the nutrients your body needs to function properly.,0.6892484426498413
"Sputum is the effusion of air through the mouth, nose, and/or other similar bodily openings.","Sputum can be a mix of mucus, blood, and bacteria.",0.7152642607688904
The licensing agreement is a contract between an organization and a licensee. It is a formal document that outlines the terms and conditions of the license agreement. The agreement is typically drawn up in a writing format and is typically signed by both parties.,"The licensing agreement is a contract between the licensor and licensee. The licensor agrees to provide the license to use the trademark or trade name to the licensee, and the licensee agrees to use the trademark or trade name in a lawful manner. The terms of the licensing agreement may include a fee, a term of use, and other conditions.",0.8835110664367676
"The majority of birds on the planet live on seeds, which provide them with the energy and nutrients to survive. Seeds are also a source of nutrients for other plant life, as they contain the necessary nutrients to support plant growth.",Most many birds live on seeds because seeds are the most common thing that birds eat.,0.854401707649231
"Yeasts can be used to test for drug substances by creating an artificial environment for drugs to be extracted from the sample. Yeasts are also used for creating a test for potential drug contamination in a laboratory, as well as for analyzing samples for potential contamination. Yeasts are also used for creating a test for potential drug contamination in a laboratory, as well as for analyzing samples for potential contamination.","There are several ways in which yeasts can be used for drug testing. Yeasts can be used to produce a specific drug of interest, yeast cells can be used to culture specific types of bacteria, and yeast cells can be used to grow new drugs.",0.9252432584762573
"Baleen whales are among the largest of the whales. They have a long, flexible and baleen-like skin that protects their body from the cold and water. Baleen whales are also highly migratory and gather along the coasts of the world's oceans. They have a distinctive and distinctive call that can be heard for up to a mile away. Baleen whales have a distinctive smell and a distinctive taste. They have a long and short life cycle and are most commonly found in shallow waters.","Some baleen whales can be as large as a bus, and can weigh up to 200 tons. They are among the biggest of the whales, and have a barrel-shaped body with a long, fleshy tongue that they use to filter food from the water.",0.7723066210746765
Bulldog can have very small nasal cavities and therefore have great difficulty keeping their body cool. This is because of their inability to cool themselves down quickly and effectively due to the very small size of their nose.,"Bulldogs have very small nasal cavities and so have great difficulty keeping their bodies cool. Their nasal cavities are also quite shallow, which means that the airflow over their skin is restricted. This makes it difficult for the bulldog to disperse their body heat, which can lead to overheating and possibly heat stroke.",0.916777491569519
The ticks love to take a break in cool weather conditions.,Damp weather conditions are perfect for ticks because they help the ticks to spread their diseases.,0.6724963188171387
"Labor productivity is increased through short process cycles, as the time required for labor to be completed increases. This is due to the need for shorter pauses for each step in the production process, as well as the speed of each step, which allows for more efficient and quick processing of data.","Labor productivity is increased through shorter process cycles when the goal is to reduce the amount of time it takes to produce a product or service. This is generally done by reducing the number of steps that need to be taken to produce a product or service. By reducing the number of steps, the time it takes to produce a product or service is reduced.",0.8427540063858032
"The differential access highlights the institution character of gender inequality. This is because gender inequality is not only a problem between men and women, but it is also a problem between those who are male and female. This inequality can lead to challenges like gender-based violence, discrimination, and more. In order to address gender inequality, it is important to ensure that everyone is treated equally and treated as equal members of the community.","Differential access highlights the institutional character of gender inequality. For example, if women have less access to certain positions or resources than men, this reveals that the gender inequality is embedded in the structure of the institution.",0.8654981851577759
"Tetanus can be fatal even when treated. It is possible to treat tetanus with a solute-based drug and some other ingredients, but it is not recommended unless the patient is certified by a medical doctor. Additionally, the duration of treatment and the severity of the condition should be carefully evaluated to determine the best course of action.","Tetanus is a serious disease caused by the bacterium Clostridium tetani. It can be fatal even when treated with antibiotics. Without treatment, 90% of people who get tetanus will die.",0.6569292545318604
"Humans are the only threat to healthy orcas, as they are highly domesticated and have been exposed to many of the same diseases as other species. The potential for human- orcas conflict has increased over the past few decades, as humans have sought to reduce the overall population of orcas. This has resulted in a growing population of humans, who are actively trying to reduce or eliminate the populations of healthy orcas.",Humans are the only danger to orcas because they are the only species of animal that kills orcas for food. Orcas are a marine mammal and are preyed upon by humans.,0.833348274230957
"Liabilities are the debts of the company, and they should be written off in full, so that the company can restructure its finances. The liabilities should be written off in proportion to their principal and this should be reflected in the company's balance sheet.","Liabilities are the debts of the company. This means that the company owes money to various creditors, such as banks, investors, and customers. The company's liabilities can also include money the company owes to itself, such as employee wages and benefits, rent, and supplies.",0.8651260733604431
"Stress tests can be used to assess heart activity during exercise. These tests rely on measuring the heart's electrical activity during exercise in order to accurately monitor and monitor the heart's activity levels. This can be done by measuring the heart's electrical activity during a test, such as a minute-long test, with a pair of electrodes placed on the chest. This can be used to monitor the heart's electrical activity and measure the stress levels of the individual.",Stress tests measure the electrical activity of the heart by recording the heart's rhythm and the electrical conduction through the heart. The tests can help physicians diagnose and treat heart conditions.,0.8896605968475342
"Spoilage can occur due to softening and disease in the eyes due to contact with environmental substances, such as food and water. If the eyes are not disinfected, the cause is likely to be a softening agent, such as chlorine or bleach. Additionally, the presence of a disease, such as infection, can cause the eyes to become discolored or tear freely.","Spoilage can occur due to softening and disease infection of the eyes. Softening of the lens can cause light to enter the eye and cause a loss of vision, while infection of the eye can cause pain, redness, and swelling.",0.8514052629470825
"Representations colonize the mind and the imagination by way of the subconscious mind. This means that the mind is influenced by them in a variety of ways, ranging from how something is described to how it looks to the content of a memory. Representations also travel through our minds and help us to interpret and make sense of the world around us.","Representations colonize the mind and the imagination by dictating what thoughts and images can be explored. They limit what is possible, and they can often be intrusive and overwhelming.",0.86729896068573
"Florida state football teams have obtained and been granted facilities to practice. These facilities are usually located in the state’s borders, such as in Miami, Fort Lauderdale, and Tampa.","Florida state football teams receive practice facilities from the university. These facilities may include fields, weight rooms, and other facilities necessary for the team to practice.",0.8816105127334595
Prostitution is the sexual exploitation of another person for the purpose of sexual gratification. It is a crime and carries with it the potential for considerable punishment.,This is a Sentence which states that Prostitution is a Crime. Prostitution is the act of providing sexual services in exchange for money. Prostitution is illegal in most places around the world.,0.7776490449905396
Hens are usually kept in coops.,"Hens live in coops because they are social animals and need to be with other hens. In a coop, the hens have a space to live and a place to lay their eggs, and they are all supervised by a human.",0.851990818977356
"Pine can be described as a tall and stout tree, with trunk diameter of up to 30 meters, and an umbrella-shaped canopy extending 30 meters above the ground. It has a dense, creeping root system and numerous pricked, needle-like needles. Pine is also an evergreen tree and can survive in both dry and moist environments.",The sentence means that pine trees have different appearances depending on where they are located.,0.5541766881942749
"Puffballs are a delicious snack that is great to eat when it is white, dry and compact. They have a crisp and chewy texture, as well as a sweet flavor. They are great for dogs, cats, and even humans who are picky eaters.","Puffballs are good to eat as long as the flesh is white, dry and compact. The flesh can be eaten raw or cooked, and can be used in recipes as a base ingredient. The texture of the puffball is soft and the flavor is mild.",0.8682022094726562
"Sound waves are a disturbance or vibration in a medium of solid, liquid, or gas. Sound waves are waves of frequency that can be experienced in different mediums; they are waves of sound that travel in the same direction and interact with each other to create audible and visible effects. Sound waves are also used in music and communication to transmit information.",Sound waves are a disturbance or vibration in the air or some other gas-based medium. They are created when an object or sound hits the air and cause the air to move.,0.9363298416137695
Some animals use tusks for eating food and for keeping cool. Tusks are often used to communicate with and communicate with other animals.,"Some animals, such as elephants and walruses, use tusks to extract food from trees or other vegetation. Tusks are also used by some animals, such as bears, to fight or protect themselves.",0.8324753046035767
Sauropods have a unique membrane which contains a large plasma membrane behind it.,Sauropods have plasma membranes that cover their internal organs. These membranes allow the sauropod to exchange oxygen and other nutrients with the environment.,0.838127076625824
"Cars are often located in bridges, as they are often used to transport goods or people between different locations.",The sentence is saying that cars are located in bridges for transportation.,0.7429686784744263
"The subjects of the sentence are saying that blood is the elixir of life, which has the power to bring about physical and mental health, wealth and prosperity.","The elixir of life is a metaphor that means something that can bring life or make life more enjoyable. In this sentence, blood is being used as the elixir of life because it is a liquid that can flow and carry life.",0.7226143479347229
"Monogenic diseases are complex illnesses that result from a combination of multiple genetic etiologies. They can be caused by a single gene or several genes, or a combination of several genes. In the past, these diseases have been predicted to have a severe impact on the human population and have had a major impact on human health. Monogenic diseases are caused by genetic changes that occur during the life span, and their severity is determined by the genetic etiologies which vary widely in different people. These diseases have caused considerable damage to the human population and are currently responsible for a heavy loss of life.","Monogenic diseases are diseases that are caused by a single gene. These diseases are very rare, and they are responsible for a heavy loss of life.",0.9375956654548645
"Empiricists believe that knowledge begins with sense perception. They believe that our perceptions and emotions are the most fundamental elements of knowledge, and that we can use our senses to understand and explain complex concepts. Thus, empiricists believe that knowledge can be gained through the use of senses such as sight, sound, smell, touch, and taste. Additionally, empiricists also believe that knowledge can be gained through the use of algorithms and machine learning.",Empiricists believe that knowledge begins with sense perception because that is the only evidence we have.,0.8287141919136047
"Broods in the tree remain in it as adults only, but also as larvae.","Broods remain in the tree and overwinter mainly as adult beetles, but also as larvae. Larvae are the juvenile form of beetles.",0.7739197015762329
Astronomers use young stars to create their own solar system and planets.,"Astronomers study young stars to learn more about how they form, how they evolve, and what might be going on inside them.",0.7062903046607971
"Gender roles exert strong influences on romantic and sexual relationships. They can be shaped by both individual differences and societal norms. Gender roles shape how people view themselves and how others view them, and they can lead to a lack of trust and respect between partners. Furthermore, gender roles can lead to unequal sexual expectations between partners, leading to an unequal feedback loop between partners and society. Therefore, it is important to manage gender roles and set healthy expectations to ensure a healthy relationship between partners.","Gender roles can exert strong influences on romantic and sexual relationships by dictating who should do what and when. For example, in a heterosexual relationship, the male typically initiates sex, whereas the female typically takes the lead in domestic duties. In a lesbian relationship, the roles may be reversed. This can create tension or problems in romantic and sexual relationships when the expectations of one or both partners are not met.",0.8392821550369263
"Carts have two spoked wheels, with each wheel bearing a ball bearings.",Spokes are the metal rods that are attached to the cart's wheels.,0.7006605267524719
"Oil is a solid, colorless, odorous, and fragrant liquid, found in all plants, animals, and all food sources. It is the main ingredient of cooking, as well as a source of fuel for many animals.",Oil is a type of cooking oil.,0.6802856922149658
Coronary arteries are responsible for supplying blood to the myocardium and other components of the heart.,"The coronary arteries supply blood to the myocardium and other components of the heart. The coronary arteries originate from the left ventricle of the heart and travel through the wall of the left ventricle to supply blood to the myocardium. The myocardium is a large, muscle-rich tissue in the heart that helps to pump blood throughout the body.",0.9017555713653564
Today's industry standard for outdoor use is pressure treated lumber.,Today's industry standard for outdoor use is pressure treated lumber. This lumber is treated with a chemical that strengthens the wood and prevents rot.,0.9407992362976074
"Copper is a essential element for the human body, so loss of its supply can have a significant economic impact. Copper deficiency is common in rural areas, where it is more widespread due to lack of access to food and other resources. In these areas, people are often reliant on food donors, who may be unable to purchase sufficient quantities of copper. This can cause economic losses where it occurs, as it can lead to the rapid spread of food shortages due to lack of access to resources.","Copper deficiency results in decreased crop production and increased costs of inputs. It can also cause a decrease in the value of copper products, as well as an increase in the cost of goods.",0.8241058588027954
"Humans are incredibly complex creatures, with numerous and diverse behaviors that can range from complex and adaptive to simple and automatic. We are born with the ability to act in accordance with our particular characteristics, but over time this ability can change and be passed down to those around us. For example, in the human body, each individual has a unique array of biological traits, such as physical beards and eye color, which can vary from one person to another and even from generation to generation. Additionally, our personality traits like extroversion, social awkwardness, and depression can all contribute to our unique behavior as we age.","""Human behavior is far more varied than traits like eye color or blood type,"" said Dr. Bob. ""A person's behavior can be influenced by a wide variety of factors, including their genes and environment.""",0.60558021068573
"All animals have the ability to heal themselves, which is a process of repairing themselves from any damage or injuries they have experienced. This healing process involves chemical and physical processes, such as the breakdown of proteins and the release of hormones that help to repair tissue and organs. All animals are able to perform this healing process, which is an important and crucial component of their survival.","All animals have the ability to heal themselves in some way or another. This includes both animals that are land-based and those that live in the water. Some animals, such as dolphins, are known for their amazing healing abilities. Other animals, such as spiders, have been known to weave amazing webs that can heal wounds.",0.7737258672714233
"Intranets use the Internet as their connection medium, as they allow users to access information from anywhere in the world, regardless of geographical distance.",Intranets use the Internet as their connection medium because they are built on top of the Internet.,0.9256733655929565
"Universities are four-year institutions that offer a wide variety of undergraduate programs. These programs range from liberal arts colleges to graduate-level universities, and offer a wide range of courses and degrees. They are established institutions that offer a wide variety of courses and degree programs, so they are well-suited for a wide range of purposes.","Universities offer a variety of undergraduate programs, including programs in arts, sciences, and business. Universities are also four-year institutions, which means that students typically attend school for four years.",0.9017330408096313
Most people have a few red spots that appear to be slowly forming.,"Most people have a few bright red spots on their body that are slow to form. These spots are called porphyria. Porphyria is a rare blood disease that causes the skin to become red, swollen, and itchy.",0.723578691482544
"Estimates of the lifespans of killer whales vary widely. Some estimates suggest the ability to estimate the lifespan of a juvenile killer whale is typically around 10 to 15 years, while some studies have suggested it may be as much as 40 years. Additionally, some studies have suggested the lifespan of an adult killer whale can be anywhere from 10 to 20 years. Furthermore, some studies have suggested that the life expectancy of an adult killer whale can be anywhere from 2 to 5 years.","There are different methods for estimating the life spans of killer whales, some of which rely on data from wildlife agencies, while others are based on more anecdotal evidence. Some scientists believe that the lifespan of a killer whale can range from 40 to 80 years, while other estimates suggest that the whales may live up to 100 years.",0.9256665706634521
"Chlorine is added to water to kill bacteria, and fluoride is added to help prevent tooth decay.","Chlorine is added to the water to kill bacteria. This is usually done by adding chlorine gas to the water supply. The chlorine gas reacts with the water to create chlorine and water vapor. The chlorine gas also kills any bacteria that is in the water. Fluoride is then added to the water to help prevent tooth decay. Fluoride is a mineral that is found in many different places, including water. When fluoride is added to the water, it creates a compound called hydrofluosilicic acid. This compound is strong enough to break down the tooth enamel.",0.9118061661720276
"Some animals such as fish, crustaceans, and mollusks graze on phytoplankton, which is a type of seaweed. Phytoplankton is composed of an assortment of small and large creatures living together in a symbiotic relationship. The organisms that live on the algae feed off of the small creatures, helping to keep their food source secure.",Some animals graze on phytoplankton because they are hungry and need to find food.,0.7566550970077515
"Some fireflies are able to live for up to two months, but in many cases, they will not return to the same spot again for up to two months. In some cases, fireflies may require more than two months to find another spot to return to.","Many fireflies live for up to two months long. In this time, they will mate, lay their eggs, and then die.",0.8117914199829102
"Reproductive isolation is one of the most important factors in the evolution of individual species. It is responsible for the process of speciation, the evolutionary process that results in the splitting of species into new species. By preventing the spread of a species' genes, reproductive isolation prevents the spread of genetic mutations that can lead to the spread of new species.",Reproductive isolation is key to the development of individual species by preventing gene flow between different groups of organisms. This allows for the evolution of new and unique species.,0.88264000415802
